input,output
What movie is set in a dystopian future where emotions are suppressed?,Equilibrium
Who directed 'The Revenant'?,Alejandro G. Iñárritu
What movie features a character named Maverick?,Top Gun
Who voiced the character of Simba in the original 'The Lion King'?,Matthew Broderick
What movie won the Best Picture Oscar in 2022?,CODA
Who starred as Captain America in the MCU?,Chris Evans
What movie is about a young girl who moves to a new city and has animated emotions?,Inside Out
What is the name of the princess in 'Sleeping Beauty'?,Aurora
What movie features a hotel called 'The Continental'?,John Wick
What movie features a bear named Paddington?,Paddington
"Who played the role of Tony Stark's assistant, Pepper Potts?",Gwyneth Paltrow
What is the name of the main character in 'The Big Lebowski'?,The Dude
What movie features a dance scene between Pulp Fiction's John Travolta and Uma Thurman?,Pulp Fiction
Who played Joker in 'Joker' (2019)?,Joaquin Phoenix
Who directed 'Parasite'?,Bong Joon-ho
What is the name of the main character in 'The Shawshank Redemption'?,Andy Dufresne
Who played the role of Neo in 'The Matrix'?,Keanu Reeves
Who played the lead role in 'La La Land'?,Ryan Gosling
What movie features the song 'This Is Me'?,The Greatest Showman
Who directed 'The Grand Budapest Hotel'?,Wes Anderson
What movie is based on the life of Stephen Hawking?,The Theory of Everything
Who starred as Lara Croft in the 2018 'Tomb Raider'?,Alicia Vikander
"What movie features the quote 'Houston, we have a problem'?",Apollo 13
Who played Severus Snape in the 'Harry Potter' series?,Alan Rickman
What is the name of the main character in 'Pirates of the Caribbean'?,Jack Sparrow
Who directed 'Once Upon a Time in Hollywood'?,Quentin Tarantino
What movie won Best Picture at the 1994 Oscars?,Schindler's List
Who starred as the main character in 'Black Swan'?,Natalie Portman
What is the main character's name in 'Mad Max: Fury Road'?,Max Rockatansky
What is the name of the hotel in 'The Shining'?,The Overlook Hotel
What movie features the quote 'Why so serious?'?,The Dark Knight
Who played Princess Leia in 'Star Wars'?,Carrie Fisher
What movie is known for the quote 'Life is like a box of chocolates'?,Forrest Gump
Who directed 'Get Out'?,Jordan Peele
Who played the titular role in 'Forrest Gump'?,Tom Hanks
"What movie features the quote 'Elementary, my dear Watson'?",The Adventures of Sherlock Holmes
Who starred as the main character in 'Edward Scissorhands'?,Johnny Depp
Who played Dorothy in 'The Wizard of Oz'?,Judy Garland
Who directed 'E.T. the Extra-Terrestrial'?,Steven Spielberg
What movie features the character Jason Bourne?,The Bourne Identity
What year was 'The Godfather Part II' released?,1974
Who played Marty McFly in 'Back to the Future'?,Michael J. Fox
Who voiced the character of Dory in 'Finding Nemo'?,Ellen DeGeneres
What is the name of the fictional city in 'Batman'?,Gotham City
What movie is about an astronaut who gets lost in space?,Gravity
What movie won the Best Picture Oscar in 2013?,Argo
Who starred as the main character in 'The Mask'?,Jim Carrey
Who played the role of Captain Phillips in the movie 'Captain Phillips'?,Tom Hanks
What movie features the song 'I Will Always Love You'?,The Bodyguard
Who directed 'There Will Be Blood'?,Paul Thomas Anderson
What movie features the character named John Connor?,Terminator 2: Judgment Day
Who played the role of Michael Corleone in 'The Godfather'?,Al Pacino
What movie is about a man trapped on a deserted island?,Cast Away
What movie features a teacher named Mr. Keating?,Dead Poets Society
Who directed 'Pan's Labyrinth'?,Guillermo del Toro
What is the name of the main character in 'Gladiator'?,Maximus
Who starred as the main character in 'Fight Club'?,Edward Norton
What movie is about a young girl who is transported to the Land of Oz?,The Wizard of Oz
What movie won the Best Picture Oscar in 2009?,Slumdog Millionaire
Who played Jack Ryan in 'The Hunt for Red October'?,Alec Baldwin
What movie features the character Neo who learns he is 'The One'?,The Matrix
Who starred as the main character in 'Titanic'?,Leonardo DiCaprio
Who directed 'The Green Mile'?,Frank Darabont
What movie features a toy cowboy named Woody?,Toy Story
Who played the role of Miranda Priestly in 'The Devil Wears Prada'?,Meryl Streep
What movie is about a college student who fights against odds in a fictional school called Princeton?,A Beautiful Mind
What movie won the Best Picture Oscar in 1981?,Chariots of Fire
Who directed 'Pulp Fiction'?,Quentin Tarantino
What movie is about a musical band called The Wonders?,That Thing You Do!
Who played the main character in 'Bruce Almighty'?,Jim Carrey
What movie features a famous dance lift in a lake?,Dirty Dancing
What is the name of the main character in 'Die Hard'?,John McClane
What movie features a group of teens dealing with a monster in Derry?,It
What movie is about a woman who falls in love with a mysterious creature?,The Shape of Water
Who played Hannibal Lecter in 'The Silence of the Lambs'?,Anthony Hopkins
What movie features the quote 'I feel the need... the need for speed'?,Top Gun
Who directed 'The Dark Knight Rises'?,Christopher Nolan
What movie is about two sisters who discover they are witches?,Practical Magic
Who played the main character in 'The Pursuit of Happyness'?,Will Smith
What movie features a song performed by Bradley Cooper and Lady Gaga?,A Star is Born
Who directed '12 Years a Slave'?,Steve McQueen
Who played the main character in 'The Sixth Sense'?,Haley Joel Osment
What movie features a man reliving the same day repeatedly?,Groundhog Day
What movie features a hitman meeting a young girl?,Leon The Professional
What is the chemical symbol for water?,H2O
What planet is known as the Red Planet?,Mars
Who developed the theory of general relativity?,Albert Einstein
What is the largest planet in our solar system?,Jupiter
What element does 'O' represent on the periodic table?,Oxygen
What gas do plants absorb from the atmosphere?,Carbon dioxide
What is the powerhouse of the cell?,Mitochondria
What is the main gas found in the Earth's atmosphere?,Nitrogen
Who is known as the father of modern physics?,Isaac Newton
What type of blood cells help our body fight infection?,White blood cells
What is the chemical symbol for gold?,Au
What is the hardest natural substance on Earth?,Diamond
What part of the human body produces insulin?,Pancreas
What is the speed of light?,"Approximately 299,792,458 m/s"
What is the process by which plants make food using sunlight?,Photosynthesis
What is the most abundant gas in the Earth's atmosphere?,Nitrogen
What planet is closest to the Sun?,Mercury
What organ in the human body is primarily responsible for filtering blood?,Kidney
What does DNA stand for?,Deoxyribonucleic Acid
What is the tallest type of grass?,Bamboo
What metal has the chemical symbol 'Fe'?,Iron
What organ is responsible for pumping blood throughout the body?,Heart
What is the most common type of star in the Milky Way?,Red dwarf
What gas is commonly used in balloons to make them float?,Helium
What is the largest organ in the human body?,Skin
What type of animal is a Komodo dragon?,Lizard
What is the main element found in diamonds?,Carbon
What is the first element on the periodic table?,Hydrogen
What is the scientific name for the process of cell division?,Mitosis
Who is credited with inventing the telephone?,Alexander Graham Bell
What force keeps planets in orbit around the Sun?,Gravity
What planet has a prominent ring system?,Saturn
What is the chemical formula for table salt?,NaCl
What is the main function of red blood cells?,To carry oxygen
What is the hottest planet in our solar system?,Venus
What is the center of an atom called?,Nucleus
What is the largest mammal on Earth?,Blue whale
What type of celestial body is the Sun?,Star
What is the main component of the sun?,Hydrogen
What is the symbol for potassium on the periodic table?,K
What is the pH level of pure water?,7
What is the rarest blood type?,AB negative
What is the most abundant element in the universe?,Hydrogen
What layer of the Earth lies just below the crust?,Mantle
What is the largest bone in the human body?,Femur
Who discovered penicillin?,Alexander Fleming
What is the term for an animal that only eats plants?,Herbivore
What part of the cell contains genetic material?,Nucleus
What natural satellite orbits Earth?,The Moon
What is the basic unit of all living organisms?,Cell
What scientist proposed the three laws of motion?,Isaac Newton
What is the chemical symbol for sodium?,Na
What is the process by which plants release oxygen called?,Photosynthesis
What type of rock is formed from cooled lava or magma?,Igneous rock
What is the main gas found in the Sun?,Hydrogen
What does the acronym 'LASER' stand for?,Light Amplification by Stimulated Emission of Radiation
What is the most abundant gas in the Earth's atmosphere?,Nitrogen
What type of blood type is considered the universal donor?,O negative
What type of star is our Sun?,G-type main-sequence star (Yellow dwarf)
What part of the human brain controls vision?,Occipital lobe
What is the term for an organism that makes its own food?,Autotroph
What unit is used to measure electrical resistance?,Ohm
What is the boiling point of water at sea level in Celsius?,100°C
What is the closest star to Earth?,The Sun
What element is the main component of diamonds?,Carbon
What is the main purpose of white blood cells?,To fight infection
What is the study of plants called?,Botany
What is the chemical symbol for silver?,Ag
What planet is known as the Morning Star or Evening Star?,Venus
What is the powerhouse of the cell?,Mitochondria
Who developed the first successful polio vaccine?,Jonas Salk
What is the most common element in the human body?,Oxygen
What organ is responsible for producing bile?,Liver
What does the Richter scale measure?,The magnitude of earthquakes
What is the term for a baby kangaroo?,Joey
What is the hottest type of star in the universe?,Blue star
What type of energy does a moving object have?,Kinetic energy
What force keeps objects grounded on Earth?,Gravity
What is the smallest unit of life?,Cell
What is the chemical symbol for lead?,Pb
What is the primary function of the human respiratory system?,To take in oxygen and expel carbon dioxide
What element has the atomic number 1?,Hydrogen
What part of the brain regulates breathing and heart rate?,Medulla oblongata
What is the study of weather called?,Meteorology
What is the largest type of star in the universe?,Red supergiant
What type of wave is light?,Electromagnetic wave
What planet is known for having a Great Red Spot?,Jupiter
What is the name of the process where cells divide to form two identical cells?,Mitosis
What is the common name for dihydrogen monoxide?,Water
What part of the human body contains the smallest bones?,Ear
What is the main function of chlorophyll in plants?,To absorb sunlight for photosynthesis
What element does 'K' represent on the periodic table?,Potassium
What is the largest land animal?,African elephant
What is the term for animals that are active during the night?,Nocturnal
What is the name of the first artificial satellite sent into space?,Sputnik
What is the chemical formula for methane?,CH4
Who proposed the law of universal gravitation?,Isaac Newton
What type of cloud is fluffy and white with a flat base?,Cumulus cloud
What is the main gas found in Earth's stratosphere?,Ozone
What is the largest planet in our solar system?,Jupiter
What is the scientific name for the study of fungi?,Mycology
What type of energy is stored in a compressed spring?,Potential energy
What is the term for a material that does not allow electricity to flow through it?,Insulator
What planet is known as the Earth's twin?,Venus
Who is known as the father of genetics?,Gregor Mendel
What is the chemical symbol for chlorine?,Cl
What is the most common type of rock found on Earth?,Sedimentary rock
What do you call a group of lions?,Pride
What is the smallest planet in our solar system?,Mercury
What part of the human eye controls the amount of light that enters?,Pupil
What type of organism can make its own food using sunlight?,Autotroph
What is the chemical symbol for magnesium?,Mg
What is the main function of the roots of a plant?,To absorb water and nutrients
What unit is used to measure the intensity of sound?,Decibel
What is the freezing point of water in Fahrenheit?,32°F
What is the study of the universe beyond Earth's atmosphere called?,Astronomy
What is the name of the galaxy that contains our solar system?,The Milky Way
What is the main component of the Earth's core?,Iron
What do you call the bond formed by the sharing of electrons between atoms?,Covalent bond
What is the largest type of whale?,Blue whale
What is the scientific term for the windpipe?,Trachea
What type of animal is a dolphin?,Mammal
What is the study of earthquakes called?,Seismology
What organ in the human body is responsible for producing red blood cells?,Bone marrow
What planet has the shortest day?,Jupiter
What does 'pH' stand for?,Potential of Hydrogen
What is the main purpose of chloroplasts in plant cells?,To conduct photosynthesis
What is the chemical formula for carbon dioxide?,CO2
What is the term for the study of living things?,Biology
What is the hottest layer of the Earth?,The inner core
What type of star is our Sun?,Main-sequence star
What is the name of the process that breaks down glucose for energy in cells?,Cellular respiration
What organelle is responsible for protein synthesis in a cell?,Ribosome
What is the main chemical component of limestone?,Calcium carbonate
What type of animal is a frog?,Amphibian
What element is used in pencils?,Graphite
What is the largest organelle in a plant cell?,Vacuole
What is the smallest particle of an element?,Atom
What part of the cell acts as its control center?,Nucleus
What is the term for an organism that feeds on other living organisms?,Heterotroph
What is the main function of the large intestine?,To absorb water and form feces
What type of rock is formed from the cooling and solidification of lava?,Igneous rock
What force causes tides on Earth?,Gravity
What is the chemical symbol for copper?,Cu
What type of animal is a bat?,Mammal
What process do plants use to convert sunlight into energy?,Photosynthesis
What is the term for a group of stars forming a recognizable pattern?,Constellation
What is the name of the gas that protects Earth from harmful UV radiation?,Ozone
What type of cloud is associated with thunderstorms?,Cumulonimbus
What is the basic unit of heredity?,Gene
What is the term for animals that eat both plants and animals?,Omnivores
What is the chemical symbol for zinc?,Zn
What part of the brain is responsible for balance and coordination?,Cerebellum
What is the main gas found in the Earth's stratosphere?,Ozone
What is the name of the largest desert in the world?,Sahara Desert
What is the process by which a caterpillar becomes a butterfly?,Metamorphosis
What is the term for water changing from a liquid to a gas?,Evaporation
What type of energy is stored in food?,Chemical energy
What is the chemical formula for rust?,Fe2O3
What type of animal is a whale?,Mammal
What is the most common blood type in humans?,O positive
What is the scientific study of insects called?,Entomology
What is the boiling point of water at sea level in Fahrenheit?,212°F
What is the most abundant metal in the Earth's crust?,Aluminum
What part of the body is affected by conjunctivitis?,Eyes
What is the name for the smallest bone in the human body?,Stapes
What is the unit used to measure force?,Newton
What is the name of the process by which cells obtain energy from glucose?,Cellular respiration
What type of celestial body is Halley's Comet?,Comet
What is the main chemical element in the Sun?,Hydrogen
What is the hardest known natural material?,Diamond
What is the primary source of energy for the Earth's climate system?,The Sun
What type of animal is a shark?,Fish
What is the process by which green plants make their food?,Photosynthesis
What is the term for a planet's path around the Sun?,Orbit
What is the most common type of star found in the Milky Way galaxy?,Red dwarf
What is the process of splitting an atom called?,Nuclear fission
What is the largest type of deer?,Moose
What element has the chemical symbol 'Ni'?,Nickel
What is the common name for sodium chloride?,Table salt
What is the term for a baby goat?,Kid
What is the study of matter and energy called?,Physics
What part of the human body is responsible for detecting light?,Eyes
What gas do living creatures exhale?,Carbon dioxide
What is the term for animals that only eat meat?,Carnivores
What is the main pigment in plants that absorbs light for photosynthesis?,Chlorophyll
What layer of the Earth is directly below the crust?,Mantle
What is the most distant planet in our solar system?,Neptune
What is the scientific name for the Northern Lights?,Aurora borealis
What is the common name for dihydrogen monoxide?,Water
What type of galaxy is the Milky Way?,Spiral galaxy
What is the main function of red blood cells?,To carry oxygen
What is the process by which ice turns directly into vapor without melting?,Sublimation
What is the name of the largest moon of Saturn?,Titan
What is the study of sound called?,Acoustics
What is the approximate age of the Earth?,4.5 billion years
What is the name of the bond between two hydrogen atoms in a molecule of hydrogen gas?,Covalent bond
What is the main organ involved in the circulatory system?,Heart
What is the primary cause of tides on Earth?,Gravitational pull from the moon
What is the most common state of matter in the universe?,Plasma
What is the name of the largest bone in the human body?,Femur
What is the chemical symbol for helium?,He
What part of a plant conducts photosynthesis?,Leaves
What is the name for a star system with two stars?,Binary star
What is the term for the force that resists the motion of objects?,Friction
What is the main gas that makes up the Earth's atmosphere?,Nitrogen
What is the study of sound waves called?,Acoustics
What is the chemical symbol for mercury?,Hg
What organ is responsible for producing bile in the human body?,Liver
What is the term for a group of stars forming a recognizable pattern?,Constellation
What element is used in thermometers and is liquid at room temperature?,Mercury
What is the smallest planet in our solar system?,Mercury
What is the process by which a solid changes directly into a gas?,Sublimation
What is the study of the weather and atmosphere called?,Meteorology
What is the scientific name for the windpipe?,Trachea
What is the term for the path taken by a planet as it orbits the Sun?,Orbit
What part of the brain is responsible for regulating balance?,Cerebellum
What is the main element that makes up the Sun?,Hydrogen
What type of animal is a platypus?,Mammal
What is the chemical formula for table salt?,NaCl
What type of organism breaks down dead organic material?,Decomposer
What is the most abundant element in the Earth's crust?,Oxygen
What is the scientific name for the process of cell division in eukaryotes?,Mitosis
What planet is known as the Red Planet?,Mars
What organ in the human body filters blood?,Kidneys
What type of rock is formed through the cooling and solidification of magma?,Igneous rock
What does DNA stand for?,Deoxyribonucleic Acid
What is the main gas in Earth's atmosphere?,Nitrogen
What type of animal is a panda?,Mammal
What is the name of the process by which plants convert sunlight into food?,Photosynthesis
What is the hottest planet in the solar system?,Venus
What type of animal is a frog?,Amphibian
What part of the human body is responsible for absorbing nutrients?,Small intestine
What is the main gas found in the Earth's ozone layer?,Ozone
"What is the term for the study of stars, planets, and galaxies?",Astronomy
What is the common name for sodium bicarbonate?,Baking soda
What planet is known for its prominent rings?,Saturn
What is the term for water changing from a gas to a liquid?,Condensation
What is the basic unit of all living organisms?,Cell
What is the primary function of the large intestine?,Absorb water
What is the most common type of blood cell in the human body?,Red blood cell
What is the term for animals that only eat plants?,Herbivores
What organelle is known as the powerhouse of the cell?,Mitochondria
What planet is farthest from the Sun?,Neptune
What is the chemical symbol for potassium?,K
What is the name of the bond formed between water molecules?,Hydrogen bond
What is the term for a large body of ice that moves slowly over land?,Glacier
What is the name of the first satellite launched into space?,Sputnik
What gas is commonly known as laughing gas?,Nitrous oxide
What is the largest type of bear?,Polar bear
What is the study of fungi called?,Mycology
What is the largest organ in the human body?,Skin
What is the term for an organism that feeds on dead organic material?,Decomposer
What is the name of the gas that plants release during photosynthesis?,Oxygen
What is the process by which plants lose water vapor through their leaves?,Transpiration
What is the name of the instrument used to measure atmospheric pressure?,Barometer
What is the chemical symbol for tin?,Sn
What is the process called when water vapor changes directly into ice?,Deposition
What is the name of the pigment that gives carrots their orange color?,Beta-carotene
What type of rock is marble?,Metamorphic rock
What part of the brain controls voluntary movement?,Cerebrum
What is the main component of natural gas?,Methane
What is the term for a baby swan?,Cygnet
What is the unit of measure for electrical current?,Ampere
What is the chemical symbol for lead?,Pb
What is the name of the smallest unit of an element?,Atom
What planet is known for having the largest volcano in the solar system?,Mars
What is the main organ responsible for detoxification in the human body?,Liver
What gas is needed for fire to burn?,Oxygen
What is the term for the study of human societies and cultures?,Anthropology
What is the smallest type of blood vessel?,Capillary
What type of energy transformation occurs in photosynthesis?,Light energy to chemical energy
What is the common name for ascorbic acid?,Vitamin C
What is the primary source of energy for Earth's climate system?,The Sun
What is the name of the device used to measure wind speed?,Anemometer
What is the chemical formula for sulfuric acid?,H2SO4
What part of the plant is responsible for producing seeds?,Flower
What is the process by which a liquid changes into a solid?,Freezing
What is the scientific term for a substance that speeds up a chemical reaction?,Catalyst
What is the name of the force that opposes the motion of an object through air?,Air resistance
What is the lightest element in the periodic table?,Hydrogen
What is the primary function of the roots of a plant?,To absorb water and nutrients
What is the study of fish called?,Ichthyology
What is the main gas that contributes to the greenhouse effect?,Carbon dioxide
What is the term for a scientist who studies insects?,Entomologist
What is the natural satellite of Earth called?,The Moon
What is the name of the scale used to measure the hardness of minerals?,Mohs scale
"What type of rock is formed from particles of sand, shells, pebbles, and other fragments?",Sedimentary rock
What part of the brain controls breathing and heart rate?,Brainstem
What is the name of the particle that carries a negative charge?,Electron
What is the name for the type of bond where atoms share electrons?,Covalent bond
What is the name of the process by which water moves through a plant and evaporates from its leaves?,Transpiration
What is the term for the study of earthquakes?,Seismology
What is the chemical formula for ammonia?,NH3
What is the largest organ inside the human body?,Liver
What type of animal is a crocodile?,Reptile
What is the most common chemical element in the universe?,Hydrogen
What is the study of the universe called?,Cosmology
What is the name of the layer of Earth that lies between the crust and the core?,Mantle
What is the chemical symbol for gold?,Au
Who is known as the 'King of Pop'?,Michael Jackson
What was The Beatles' first #1 hit in the United States?,I Want to Hold Your Hand
Who is the lead singer of the rock band Queen?,Freddie Mercury
What year was the album 'Thriller' released?,1982
Who is known for the hit song 'Shape of You'?,Ed Sheeran
What is the best-selling album of all time?,Thriller by Michael Jackson
Who won the first season of 'American Idol'?,Kelly Clarkson
Which artist sang the 2014 hit 'Happy'?,Pharrell Williams
What is the name of the lead vocalist of the band Coldplay?,Chris Martin
Who is known as the 'Queen of Pop'?,Madonna
What band released the album 'Dark Side of the Moon'?,Pink Floyd
Which artist released the song 'Blinding Lights'?,The Weeknd
What singer is known as 'The Boss'?,Bruce Springsteen
Who won Album of the Year at the 2021 Grammy Awards?,Taylor Swift for 'Folklore'
Which band released the hit song 'Smells Like Teen Spirit'?,Nirvana
What year did Elvis Presley die?,1977
Who is the youngest solo artist to achieve a #1 on the Billboard Hot 100?,Billie Eilish
Which rapper released the album 'The Marshall Mathers LP'?,Eminem
Who is known for the song 'Rolling in the Deep'?,Adele
What is Lady Gaga's real name?,Stefani Joanne Angelina Germanotta
Which band sang 'Hotel California'?,Eagles
Who released the album '25' in 2015?,Adele
