input,output
What is the highest peak in North America?,Denali
What is the official language of Thailand?,Thai
What is the capital of Ukraine?,Kyiv
What mountain range runs through Morocco?,Atlas Mountains
What is the longest river in Asia?,Yangtze River
What is the capital of Poland?,Warsaw
What is the largest island in the Mediterranean Sea?,Sicily
What is the capital of Peru?,Lima
What country shares the longest land border with the United States?,Canada
What is the largest lake in South America?,Lake Titicaca
What is the capital of New Zealand?,Wellington
What is the southernmost continent called?,Antarctica
What river runs through the city of Rome?,Tiber River
What is the capital of Malaysia?,Kuala Lumpur
What country is home to the Great Barrier Reef?,Australia
What is the capital of Austria?,Vienna
What U.S. state is known for the Grand Canyon?,Arizona
What is the name of the tallest mountain in Japan?,Mount Fuji
What is the capital of Denmark?,Copenhagen
What is the largest city in Africa by population?,Lagos
What country is known as the Land of a Thousand Lakes?,Finland
What is the capital of Bangladesh?,Dhaka
What river is the longest in China?,Yangtze River
What U.S. state is known as the 'Lone Star State'?,Texas
What is the capital of Hungary?,Budapest
What mountain range spans the western coast of South America?,Andes
What is the capital of Nepal?,Kathmandu
What is the deepest ocean in the world?,Pacific Ocean
What is the capital of Saudi Arabia?,Riyadh
What European country is known for its fjords?,Norway
What is the capital of Iraq?,Baghdad
What sea is located between Saudi Arabia and Iran?,Persian Gulf
What is the capital of Ecuador?,Quito
What is the largest country in Europe by area?,Russia
What is the capital of Morocco?,Rabat
What U.S. state is known for Yellowstone National Park?,Wyoming
What is the name of the river that runs through London?,Thames River
What is the capital of the Czech Republic?,Prague
What is the name of the peninsula shared by Spain and Portugal?,Iberian Peninsula
What country is the largest producer of coffee in the world?,Brazil
What is the capital of Venezuela?,Caracas
What mountain range is located in Italy?,Apennine Mountains
What is the capital of Sri Lanka?,Sri Jayawardenepura Kotte
What is the smallest country in the world by population?,Vatican City
What U.S. state is known for the Everglades?,Florida
What is the capital of Iran?,Tehran
What river forms part of the border between the U.S. and Mexico?,Rio Grande
What is the largest island in the Caribbean?,Cuba
What country is home to Machu Picchu?,Peru
What is the capital of Bulgaria?,Sofia
What is the capital of Singapore?,Singapore
What country is known for the city of Casablanca?,Morocco
What river is the main waterway in Egypt?,Nile River
What is the capital of Serbia?,Belgrade
What country is famous for its windmills and tulips?,Netherlands
What is the highest peak in South America?,Aconcagua
What is the capital of Zimbabwe?,Harare
What is the largest bay in the world?,Bay of Bengal
What is the capital of Algeria?,Algiers
What is the capital of Croatia?,Zagreb
What body of water separates the UK and France?,English Channel
What is the capital of Mongolia?,Ulaanbaatar
What is the capital of Norway?,Oslo
What country is home to the city of Salzburg?,Austria
What is the capital of Paraguay?,Asunción
What river is the longest in the United States?,Missouri River
What is the capital of Senegal?,Dakar
What country is home to the Dolomites?,Italy
What is the capital of Chile?,Santiago
What is the capital of Ethiopia?,Addis Ababa
What is the name of the river that flows through Baghdad?,Tigris River
What is the largest country in the world by area?,Russia
What is the capital of Tunisia?,Tunis
What is the smallest ocean in the world?,Arctic Ocean
What is the capital of Slovenia?,Ljubljana
What country is known as the Land of Fire and Ice?,Iceland
What is the capital of Cyprus?,Nicosia
What is the longest river in the United Kingdom?,River Severn
What is the capital of Luxembourg?,Luxembourg City
What U.S. state is known as the 'Aloha State'?,Hawaii
What is the capital of Myanmar?,Naypyidaw
What is the highest peak in Europe?,Mount Elbrus
What is the capital of Malta?,Valletta
What is the second largest country in the world by land area?,Canada
What river runs through the city of Vienna?,Danube River
What is the capital of Bhutan?,Thimphu
What U.S. state has the nickname 'The Empire State'?,New York
What is the capital of Lithuania?,Vilnius
What is the capital of Iceland?,Reykjavik
What desert is located in southern Africa?,Kalahari Desert
What is the capital of Costa Rica?,San José
What is the largest island in the world by area?,Greenland
What is the capital of Estonia?,Tallinn
What is the name of the strait that separates Europe from Asia?,Bosporus Strait
What country is home to the city of Kyoto?,Japan
What is the capital of Oman?,Muscat
What river forms the eastern border of Germany with Poland?,Oder River
What is the capital of Uruguay?,Montevideo
What is the name of the sea between Australia and New Zealand?,Tasman Sea
What is the capital of Slovakia?,Bratislava
What is the capital of Bosnia and Herzegovina?,Sarajevo
What is the name of the peninsula that contains Spain and Portugal?,Iberian Peninsula
What is the capital of Honduras?,Tegucigalpa
What U.S. state is known as 'The Last Frontier'?,Alaska
What is the capital of Guatemala?,Guatemala City
What country is home to the city of Timbuktu?,Mali
What is the capital of Georgia (the country)?,Tbilisi
What mountain range runs through Romania?,Carpathian Mountains
What is the capital of El Salvador?,San Salvador
What is the capital of Latvia?,Riga
What U.S. state is known for having the most national parks?,California
What is the name of the waterfall that borders Canada and the U.S.?,Niagara Falls
What is the capital of Azerbaijan?,Baku
What is the largest city in South Korea?,Seoul
What is the name of the longest mountain range in North America?,Rocky Mountains
What is the capital of Yemen?,Sana'a
What U.S. state is known as the 'Peach State'?,Georgia
What is the capital of Cyprus?,Nicosia
What country is home to the city of Fez?,Morocco
What is the capital of Kyrgyzstan?,Bishkek
What is the largest desert in Australia?,Great Victoria Desert
What is the capital of Fiji?,Suva
What is the longest river in Canada?,Mackenzie River
What is the capital of Lebanon?,Beirut
What mountain range forms part of the border between Spain and France?,Pyrenees
What is the capital of Papua New Guinea?,Port Moresby
What U.S. state is home to Mount Whitney?,California
What is the capital of Armenia?,Yerevan
What river runs through the city of Budapest?,Danube River
What is the capital of Nicaragua?,Managua
What is the capital of Madagascar?,Antananarivo
What is the name of the region in Africa known for its extensive wildlife and savannas?,Serengeti
What is the capital of the Maldives?,Malé
What is the largest sea in the world by area?,Philippine Sea
What is the capital of Tajikistan?,Dushanbe
What is the official language of Kenya?,Swahili and English
What is the capital of Mozambique?,Maputo
What U.S. state is known as the 'Volunteer State'?,Tennessee
What is the name of the island country off the southeastern coast of Africa?,Madagascar
What is the capital of Qatar?,Doha
What country is home to the city of Lahore?,Pakistan
What is the highest mountain in the Southern Hemisphere?,Aconcagua
What is the capital of Estonia?,Tallinn
What river forms part of the border between Thailand and Laos?,Mekong River
What is the capital of the Bahamas?,Nassau
What country is home to the city of Aleppo?,Syria
What is the capital of Burkina Faso?,Ouagadougou
What is the capital of Trinidad and Tobago?,Port of Spain
What is the main river that flows through Baghdad?,Tigris River
What is the capital of Liberia?,Monrovia
What is the capital of Montenegro?,Podgorica
What is the largest lake in North America?,Lake Superior
What is the capital of Namibia?,Windhoek
What river runs through the city of Cairo?,Nile River
What is the capital of Jordan?,Amman
What is the capital of Uzbekistan?,Tashkent
What U.S. state is home to Denali (formerly known as Mount McKinley)?,Alaska
What is the name of the world's largest coral reef system?,Great Barrier Reef
What is the capital of Chad?,N'Djamena
What country is home to Mount Kilimanjaro?,Tanzania
What is the capital of Ghana?,Accra
What is the largest city in Brazil by population?,São Paulo
What is the capital of Haiti?,Port-au-Prince
What U.S. state is known as the 'Show-Me State'?,Missouri
What is the capital of Moldova?,Chișinău
What is the capital of Cambodia?,Phnom Penh
What is the name of the peninsula shared by Norway and Sweden?,Scandinavian Peninsula
What is the capital of Sierra Leone?,Freetown
What is the name of the strait that separates Alaska from Russia?,Bering Strait
What is the capital of Somalia?,Mogadishu
What is the capital of Zambia?,Lusaka
What is the name of the strait that connects the Mediterranean Sea to the Atlantic Ocean?,Strait of Gibraltar
What is the capital of Georgia (the state)?,Atlanta
What is the capital of Malawi?,Lilongwe
What is the second largest ocean in the world?,Atlantic Ocean
What is the capital of Eritrea?,Asmara
What is the name of the highest mountain in Europe?,Mount Elbrus
What is the capital of Kuwait?,Kuwait City
What U.S. state is known as the 'Bluegrass State'?,Kentucky
What is the capital of Laos?,Vientiane
What is the name of the river that flows through Paris?,Seine River
What country is known as the Land of the Rising Sun?,Japan
What is the capital of Malta?,Valletta
What is the capital of Liechtenstein?,Vaduz
What is the capital of North Macedonia?,Skopje
What is the capital of Gabon?,Libreville
What is the capital of Kazakhstan?,Astana (Nur-Sultan)
What U.S. state is known as the 'Beehive State'?,Utah
What is the capital of Djibouti?,Djibouti
What is the capital of Mauritius?,Port Louis
What country is home to the ancient ruins of Angkor Wat?,Cambodia
What is the largest country in the Middle East by area?,Saudi Arabia
What is the name of the bay that borders Bangladesh?,Bay of Bengal
What is the capital of Suriname?,Paramaribo
What is the capital of Seychelles?,Victoria
What is the highest point in Africa?,Mount Kilimanjaro
What is the capital of Guyana?,Georgetown
What is the capital of Rwanda?,Kigali
What U.S. state is known as the 'Gem State'?,Idaho
What is the capital of Turkmenistan?,Ashgabat
What is the capital of the Democratic Republic of the Congo?,Kinshasa
What is the capital of Tonga?,Nukuʻalofa
What river flows through the city of Warsaw?,Vistula River
What is the capital of Antigua and Barbuda?,St. John's
What U.S. state is home to the city of Juneau?,Alaska
What is the capital of Belize?,Belmopan
What is the name of the world's second longest river?,Amazon River
What is the capital of Moldova?,Chișinău
What is the name of the sea that separates Italy from the Balkans?,Adriatic Sea
What is the capital of Lesotho?,Maseru
What country is home to the Gobi Desert?,Mongolia
What is the capital of Samoa?,Apia
What is the capital of the Solomon Islands?,Honiara
What is the smallest country in Asia by area?,Maldives
What is the capital of Eswatini (Swaziland)?,Mbabane
What river runs through the city of Madrid?,Manzanares River
What is the capital of Bolivia?,La Paz (administrative) and Sucre (constitutional)
Who directed the movie 'Inception'?,Christopher Nolan
What is the highest-grossing film of all time (as of 2023)?,Avatar
Who played Jack Dawson in 'Titanic'?,Leonardo DiCaprio
What year was the first 'Star Wars' movie released?,1977
What film won the Best Picture Oscar in 2020?,Parasite
Who voices Woody in 'Toy Story'?,Tom Hanks
"What movie features the line 'Here's looking at you, kid'?",Casablanca
What was the first feature-length animated movie?,Snow White and the Seven Dwarfs
Who played the Joker in 'The Dark Knight'?,Heath Ledger
Which film franchise features a character named John Wick?,John Wick
Who directed 'Pulp Fiction'?,Quentin Tarantino
What movie features the line 'I am your father'?,Star Wars: The Empire Strikes Back
Who played Forrest Gump?,Tom Hanks
Which movie is known for the quote 'I'll be back'?,The Terminator
What is the name of the kingdom in 'Frozen'?,Arendelle
Which actor has played James Bond the most times?,Roger Moore
Who played Hermione Granger in the 'Harry Potter' series?,Emma Watson
What was the first movie in the Marvel Cinematic Universe?,Iron Man
Who directed 'Schindler's List'?,Steven Spielberg
Which movie features the line 'You talking to me?'?,Taxi Driver
Who played the role of Black Panther?,Chadwick Boseman
What movie won the Best Picture Oscar in 1994?,Forrest Gump
Who starred as the main character in 'The Matrix'?,Keanu Reeves
What is the name of the AI in '2001: A Space Odyssey'?,HAL 9000
What movie is known for the song 'My Heart Will Go On'?,Titanic
What was the first James Bond film?,Dr. No
Who played Captain Jack Sparrow?,Johnny Depp
Who directed 'The Godfather'?,Francis Ford Coppola
What year was 'The Shawshank Redemption' released?,1994
What movie features a talking robot named WALL-E?,WALL-E
Who played Tony Stark/Iron Man?,Robert Downey Jr.
Which movie features a famous scene with a DeLorean time machine?,Back to the Future
Who won the Oscar for Best Actress in 2021?,Frances McDormand
What is the name of the hobbit played by Elijah Wood in 'The Lord of the Rings'?,Frodo Baggins
Who directed the movie 'Psycho'?,Alfred Hitchcock
What movie featured the song 'Hakuna Matata'?,The Lion King
Which movie did Leonardo DiCaprio win his first Oscar for Best Actor?,The Revenant
What movie is about a group of teenagers in detention on a Saturday?,The Breakfast Club
Who played the main character in 'Gladiator'?,Russell Crowe
What movie features the quote 'Say hello to my little friend'?,Scarface
Who directed 'Jurassic Park'?,Steven Spielberg
What movie won the Best Picture Oscar in 2022?,CODA
What is the name of the main character in 'Kill Bill'?,The Bride
Which actor plays John McClane in 'Die Hard'?,Bruce Willis
What movie features a character named Jack Torrance?,The Shining
What movie is based on the life of Facebook's founder?,The Social Network
Who directed 'The Grand Budapest Hotel'?,Wes Anderson
What movie is about a boxer named Rocky Balboa?,Rocky
What movie features a character named Neo?,The Matrix
Who played the titular role in 'Edward Scissorhands'?,Johnny Depp
Who played the character of Harry Potter?,Daniel Radcliffe
Which movie features the quote 'Why so serious?'?,The Dark Knight
Who directed 'The Lord of the Rings' trilogy?,Peter Jackson
What movie features the song 'Shallow'?,A Star is Born
Who starred as James Bond in 'Skyfall'?,Daniel Craig
What is the highest-grossing animated film of all time (as of 2023)?,Frozen II
Which actor played the Terminator in the 'Terminator' series?,Arnold Schwarzenegger
What year did 'The Lion King' (original) release?,1994
Who directed 'Avatar'?,James Cameron
What movie is famous for the line 'May the Force be with you'?,Star Wars
What is the name of the hobbit played by Martin Freeman in 'The Hobbit'?,Bilbo Baggins
Who starred in the lead role of 'The Truman Show'?,Jim Carrey
What film featured Tom Hanks as a captain trying to save his ship from pirates?,Captain Phillips
Who directed 'Goodfellas'?,Martin Scorsese
Which film is known for the line 'You can't handle the truth!'?,A Few Good Men
Who voiced the character of Genie in the original 'Aladdin'?,Robin Williams
What movie features a character called Jack Skellington?,The Nightmare Before Christmas
Who played Wolverine in the 'X-Men' series?,Hugh Jackman
What movie is about a cyborg assassin sent from the future?,The Terminator
Who directed 'Jaws'?,Steven Spielberg
"What is the name of the movie where a group of friends reunites at their high school reunion, featuring John Cusack?",Grosse Pointe Blank
What is the main character's name in 'Toy Story' who is voiced by Tim Allen?,Buzz Lightyear
What movie won the Best Picture Oscar in 2017 after a mix-up during the announcement?,Moonlight
What movie is about a man who ages backward?,The Curious Case of Benjamin Button
Who directed 'Django Unchained'?,Quentin Tarantino
Who played the role of Maximus in 'Gladiator'?,Russell Crowe
What movie featured the famous line 'To infinity and beyond'?,Toy Story
Who played the character of Tony Montana in 'Scarface'?,Al Pacino
Which movie is known for the dance scene with John Travolta and Uma Thurman?,Pulp Fiction
Who played the role of Lara Croft in the 2001 film 'Lara Croft: Tomb Raider'?,Angelina Jolie
What is the name of the hotel in 'The Shining'?,The Overlook Hotel
What film features a character named Vito Corleone?,The Godfather
What movie is set in a future where the government controls birthrates and the main character is named Theo Faron?,Children of Men
What film won Best Picture at the Oscars in 2021?,Nomadland
Who directed 'Titanic'?,James Cameron
What is the name of the princess in 'The Princess Bride'?,Princess Buttercup
Who played the main character in 'Cast Away'?,Tom Hanks
Which movie features the song 'Eye of the Tiger'?,Rocky III
What movie features the quote 'I'll have what she's having'?,When Harry Met Sally
Who directed 'Inglourious Basterds'?,Quentin Tarantino
Who played the lead in 'The Silence of the Lambs'?,Jodie Foster
What is the name of the fictional African country in 'Black Panther'?,Wakanda
Which movie is about a man who relives the same day over and over again?,Groundhog Day
What film features a killer shark and was a blockbuster hit in 1975?,Jaws
Who played the role of Indiana Jones?,Harrison Ford
Which actor voiced the character of Donkey in 'Shrek'?,Eddie Murphy
What film is about a young lion prince who flees his kingdom after his father is killed?,The Lion King
What movie features a man who must live inside an airport terminal?,The Terminal
Who directed 'The Grand Budapest Hotel'?,Wes Anderson
Who starred as the lead in 'Mad Max: Fury Road'?,Tom Hardy
Who directed 'The Shape of Water'?,Guillermo del Toro
Who played the titular role in 'Mrs. Doubtfire'?,Robin Williams
What is the highest-grossing R-rated movie of all time (as of 2023)?,Joker
Who played the role of Katniss Everdeen in 'The Hunger Games'?,Jennifer Lawrence
What movie features the line 'E.T. phone home'?,E.T. the Extra-Terrestrial
Which film features a character named Hannibal Lecter?,The Silence of the Lambs
Who starred in the lead role of 'Braveheart'?,Mel Gibson
What movie won the Best Picture Oscar in 1999?,Shakespeare in Love
Who played Jack in 'The Shining'?,Jack Nicholson
What film features the character Gollum?,The Lord of the Rings
Who directed 'The Social Network'?,David Fincher
Which movie features the quote 'You had me at hello'?,Jerry Maguire
What movie stars Jim Carrey as a man whose life is secretly a TV show?,The Truman Show
Who played the role of Wonder Woman in the 2017 movie?,Gal Gadot
What movie features the character John McClane?,Die Hard
Who directed 'The Wolf of Wall Street'?,Martin Scorsese
What movie is about a British soldier held in a German POW camp during WWII?,The Great Escape
What movie features a killer clown named Pennywise?,It
What is the name of the spaceship in 'Alien'?,Nostromo
Who directed 'The Revenant'?,Alejandro G. Iñárritu
What movie is based on a true story about the rise of Facebook?,The Social Network
Who played Rick Deckard in 'Blade Runner'?,Harrison Ford
What movie features the line 'Nobody puts Baby in a corner'?,Dirty Dancing
What is the name of the movie where robots from space battle on Earth?,Transformers
Who played the role of Lara Jean in 'To All the Boys I've Loved Before'?,Lana Condor
What movie won Best Animated Feature at the 2021 Oscars?,Soul
Who played the role of Tony Stark/Iron Man in the Marvel Cinematic Universe?,Robert Downey Jr.
Who directed 'Dune' (2021)?,Denis Villeneuve
What movie features a man trying to survive on Mars?,The Martian
Who played the main character in 'A Beautiful Mind'?,Russell Crowe
What is the name of the hotel in 'John Wick'?,The Continental
Who starred as the lead in 'Bird Box'?,Sandra Bullock
What is the name of the main character in 'The Matrix' played by Keanu Reeves?,Neo
Which actor played Freddie Mercury in 'Bohemian Rhapsody'?,Rami Malek
Who directed the movie '1917'?,Sam Mendes
What movie features the song 'Let It Go'?,Frozen
Who played the character of Tony Montana in 'Scarface'?,Al Pacino
Which movie franchise is centered around racing cars and heists?,Fast & Furious
What movie features the character Jack Sparrow?,Pirates of the Caribbean
Who directed 'The Irishman'?,Martin Scorsese
What movie won the Best Picture Oscar in 1998?,Titanic
Who voiced the character of Simba in the 2019 version of 'The Lion King'?,Donald Glover
What movie features the song 'Over the Rainbow'?,The Wizard of Oz
Who played the character of Black Widow in the MCU?,Scarlett Johansson
What is the name of the computer in 'The Matrix' that rules over humanity?,The Architect
What movie is about a dystopian world where books are banned?,Fahrenheit 451
Who played the role of Mia in 'La La Land'?,Emma Stone
What movie features a character named Captain America?,Captain America: The First Avenger
Who played the main role in 'The Pursuit of Happyness'?,Will Smith
Who directed 'The Grand Budapest Hotel'?,Wes Anderson
Who played the character Jack in 'Titanic'?,Leonardo DiCaprio
What movie is famous for the quote 'You're gonna need a bigger boat'?,Jaws
Who directed 'Inglourious Basterds'?,Quentin Tarantino
What is the name of the lead character in 'The Matrix'?,Neo
Who starred as The Bride in 'Kill Bill'?,Uma Thurman
What year was 'Jurassic Park' released?,1993
Who directed 'Blade Runner 2049'?,Denis Villeneuve
What movie won the Best Picture Oscar in 1995?,Forrest Gump
Who played the role of Clarice Starling in 'The Silence of the Lambs'?,Jodie Foster
What movie features a character named Andy Dufresne?,The Shawshank Redemption
Who played Mary Poppins in the original 1964 movie?,Julie Andrews
What movie is about an astronaut stranded on Mars?,The Martian
Who voiced the character of Woody in 'Toy Story'?,Tom Hanks
What movie features the character John Rambo?,First Blood
Who directed 'Schindler's List'?,Steven Spielberg
Who played the main character in 'Forrest Gump'?,Tom Hanks
What is the name of the main antagonist in 'The Dark Knight'?,The Joker
What movie features the song 'Hakuna Matata'?,The Lion King
What year did 'The Godfather' premiere?,1972
Who played James Bond in 'GoldenEye'?,Pierce Brosnan
Who starred as the main character in 'Cast Away'?,Tom Hanks
What movie features a character named Vito Corleone?,The Godfather
Who directed 'Saving Private Ryan'?,Steven Spielberg
What movie features the line 'I'll be back'?,The Terminator
Who played the main character in 'The Truman Show'?,Jim Carrey
What movie is about a man who ages backward?,The Curious Case of Benjamin Button
Who played the role of Indiana Jones?,Harrison Ford
"What movie features the line 'Here's looking at you, kid'?",Casablanca
Who directed 'Pulp Fiction'?,Quentin Tarantino
What is the name of the character who said 'I see dead people'?,Cole Sear
Who played Batman in 'The Dark Knight'?,Christian Bale
What movie won Best Picture at the Oscars in 2020?,Parasite
Who voiced the character of Elsa in 'Frozen'?,Idina Menzel
Who played Captain Jack Sparrow in 'Pirates of the Caribbean'?,Johnny Depp
What movie features the line 'You can't handle the truth!'?,A Few Good Men
What is the name of the robot in 'WALL-E'?,WALL-E
Who directed the movie 'Dunkirk'?,Christopher Nolan
What movie is based on a true story about King George VI's stammer?,The King's Speech
What year was the first 'Star Wars' movie released?,1977
What movie features the character Tony Stark?,Iron Man
Who directed 'The Departed'?,Martin Scorsese
What movie is about a group of friends who reunite at their high school reunion?,Grosse Pointe Blank
Who played Wolverine in the 'X-Men' series?,Hugh Jackman
Who played the main character in 'Joker' (2019)?,Joaquin Phoenix
What movie features the song 'My Heart Will Go On'?,Titanic
Who played the role of Ellen Ripley in 'Alien'?,Sigourney Weaver
Who starred as the main character in 'The Revenant'?,Leonardo DiCaprio
Who directed 'Avatar'?,James Cameron
What movie is about a young wizard who attends Hogwarts?,Harry Potter and the Sorcerer's Stone
Who directed 'The Hurt Locker'?,Kathryn Bigelow
What movie features the quote 'I'll make him an offer he can't refuse'?,The Godfather
Who starred as the main character in 'Rocky'?,Sylvester Stallone
What movie features the song 'Everything Is Awesome'?,The Lego Movie
Who played the role of Edward Cullen in 'Twilight'?,Robert Pattinson
Who directed 'The Irishman'?,Martin Scorsese
What movie features a group of women called 'The Pink Ladies'?,Grease
What is the name of the school in 'Mean Girls'?,North Shore High School
Who played the role of John Wick?,Keanu Reeves
Who directed 'Interstellar'?,Christopher Nolan
What movie is about a clown who terrorizes children in Derry?,It
Who played the character of Bridget Jones?,Renée Zellweger
What movie is known for the line 'As if!'?,Clueless
What movie features the character Travis Bickle?,Taxi Driver
Who played the role of Jack Sparrow?,Johnny Depp
What is the name of the space ship in 'Guardians of the Galaxy'?,The Milano
Who played the character of Ripley in 'Alien'?,Sigourney Weaver
